{
  "schema_version": "1.0.0",
  "profile_id": "curtain-a-001",
  "configuration": "curtain",
  "measurements": [
    {
      "frequency_hz": 2437000000.0,
      "attenuation_db": 18.2,
      "uncertainty_db": 2.4
    },
    {
      "frequency_hz": 5500000000.0,
      "attenuation_db": 24.1,
      "uncertainty_db": 3.1
    }
  ],
  "seams": "200mm overlap",
  "floor": false,
  "feedthrough": "none; battery inside",
  "notes": "training field sample only"
}
